,0
0,中国网络技术跃居世界第一占据全球主导权
1,人脑和机器能直接通讯吗？
2,我国空间互联网星座系统发展战略研究
3,工信部：新型数据中心站上新风口
4,量子信息网络概念原理与发展前景初探
5,物联网技术如何助力企业转型升级？
6,数字化转型白皮书：数智技术驱动智能制造
7,数字技术如何改变经济活动？
8,Gartner：2021年八大供应链技术趋势
9,王青林：5G时代数字金融创新与思考
10,区块链技术如何赋能智能制造？
11,从“嵌入式”到“物联网”有哪些变化？ 
12,李开复：AI技术驱动的二十年五大预测
13,新技术下的机遇与挑战
14,技术进步为经济空间模式带来什么影响？
15,为什么机器学习算法难以优化？
16,机器学习算法的四大金刚
17,清华学子“华智冰”，能否秒杀众校友？
18,2021量子计算技术创新与趋势展望
19,京东云正在实践云计算价值
20,零售企业如何抓住“技术红利”的救命稻草？
21,从人口红利到技术红利 谁将逐鹿科技之巅？
22,仓储物流技术发展趋势分析
23,科技巨头布局5G、物联网、AR领域，谁将崛起？
24,周济：智能制造是第四次工业革命的核心技术
25,2025年，AI将会发生质的飞跃
26,区块链中的博弈论的运用
27,5G：创造未来的新技术
28,物联网技术赋能 “智慧法院”建设再升级
29,5G技术在物流核心设备中的应用
30,从SPACE矩阵，看5G究竟是否在走向成功？
31,重构新型高技术服务业内涵 助力现代产业体系高质量发展
32,未来30年，绝对是硬科技的黄金时代
33,苏宁银行：做科技驱动的新型银行，做市场的“缝隙业务”
34,SpaceX创新机制及对我国发展的启示
35,“退休”智能手机成简易智能家居终端“再就业”
36,2021人工智能在工业领域的应用研究
37,5G核心网智能监控加速度！
38,陈春花、廖建文：重新认知行业—数字化时代的生态空间
39,揭秘腾讯第四次战略升级
40,指数型技术如何重塑我们的明天？
41,阿里云拟独立运营并上市，云计算的江湖即将大“变天”？
42,拍卖理论与设计:2020 年诺贝尔经济学奖评述与启示
43,数字孪生，工信部权威白皮书！拆解6大应用背后万亿市场
44,腾讯司晓：区块链如何在数字世界中重塑所有权？
45,2021达摩院十大科技趋势
46,技术真的是中立的吗？
47,吴菁芃：行业物流技术汇聚—谈谈新零售物流需求预测方法​
48,人类应该如何处理人工智能的机器语言效应？
49,JIBS: 国际数字商务中生态系统的特有优势
50,人工智能的“伦理转向”
51,容易被外国“卡脖子”的七大关键核心技术一览
52,未来三年内，人工智能将深刻地改变人类活动方式
53,大糖粮：技术创新，打造大宗糖粮产业链全新生态圈
54,审视数据安全在国家层面的重要意义
55,“科技+零售”，才是「终极战场」？
56,百度量子成果连续亮相国际顶会
57,区块链技术加速推动货币替代
58,反思技术时代的治理变革
59,数智化：技术赋能数字政府
60,京东科技的未来“秘密” 
61,“大数据+会计”：新技术重塑新财经教育
62,AI产业链追踪：底层核心与高端产品受国际巨头垄断 
63,如何构建有效的边缘物联网架构？
64,分布式 SQL：数据库的未来发展方向
65,产业价值重构，谁将是车联网数字经济之王？
66,数字科技的“三宗罪”
67,量子科技革命已成为当今世界一个核心的引擎
68,资本助推技术创新，高端制造龙头积极融入国家发展战略 
69,数据创新的四个陷阱
70,新技术重塑供应链将成为趋势
71,大数据等新技术助推——互联网连接从“人”转向“物”
72,数字科技：不是去互联网化，而是去金融化
73,人工智能经历了哪三个发展阶段？
74,人工智能的未来发展趋势：量子计算、专家系统、可塑性网络
75,智慧农业分为物联网、云计算、大数据三大方向
76,最新研究：超级人工智能，从理论上就无法控制
77,区块链与物联网融合发展的机遇与挑战
78,人工智能、数据科学、机器学习研究在 2020 有哪些重大进展？
79,“十四五”时期卡脖子技术的破解：识别框架、战略转向与突破路径
80,物联网，大数据，人工智能，构建智能世界的技术金字塔
81,大数据智能分析的“六个特征”和“六个能力”
82,量子密码：推进军工发展
83,影响未来的重要科技发展趋势
84,重磅！百度研究院发布2021年十大科技趋势预测
85,人工智能时代，技术不中立
86,2021—2025年数字经济九大技术趋势展望
87,数智化：技术如何赋能数字政府新基建
88,腾讯启动碳中和规划：用科技助力实现0碳排放
89,回顾2020年人工智能十大技术进展
90,回顾2020年基于区块链技术的供应链金融白皮书
91,构建大数据知识管理体系
92,技术真的是中立的吗？
93,2021制造业人工智能8大应用场景！
94,智能制造产业的主要领域和发展特征
95,自动化仓库控制系统的优化改造
96,变量：影响2021年的14个科技应用趋势
97,总体国家安全观视角下的区块链与国家安全
98,里程碑式突破：中国科学家实现“量子霸权”
99,量子计算机“九章”问世：速度比谷歌量子计算机快100亿倍
100,云银行的逻辑与核心技术
101,罗玫：区块链技术如何赋能小微企业融资
102,当传统物流遇上大数据
103,医疗健康搜索，以场景优化牵引服务链重构
104,大数据思维辅助企业内部审计转型
105,数字化经营系列②|数字组织：重构生产关系
106,大数据创新价值链：新基建时代的管理创新
107,一文读懂量子计算：应用、布局与未来（下）
108,一文读懂量子计算：应用、布局与未来（上）
109,区块链:构建电商信用体系的重要手段
110,阿里发布今年双11十大前沿技术
111,Gartner发布2021年重要战略科技趋势
112,智能定制已成零售竞争的护城河！
113,微软小冰能实现纺织产业商业化
114,麻省理工选出的全球十大突破性技术
115,区块链的本质浅析
116,来自技术悲观主义者的警示：数字技术无法扭转美国经济颓势？
117,中美竞争背景下的芯片
118,物流科技的本质与应用
119,世界上最顶尖的技术都在哪些国家？
120,终于有人把云计算、物联网和大数据讲明白了
121,技术与思想：区块链的双重属性
122,「国际锐评」新经济创造中国发展新机遇
123,大数据分析为什么越来越受到大家的追捧？
124,BI分析系统概述
125,AI技术在零售业如何落地？
126,黑科技赋能｜零售行业的“滴滴打工”来了
127,段大为：“顶天立地”“平台+赛道”助力产业发展
128,多方计算—打开区块链应用新场景
129,吴菁芃：重塑物流技术与应用——设备设施专题（番外篇）
130,阿里巴巴科技领域发展之路
131,吴菁芃：重塑物流技术与应用——设备设施专题
132,吴菁芃：重塑物流技术与应用——设备设施专题
133,什么是自动化立体仓库？
134,全球冷库分拣难题被攻克：立镖机器人获冷库自动化多项技术优势
135,5G助推物流智能化时代加速到来
136,全球冷库分拣难题被攻克
137,潘云鹤院士：人工智能要瞄准学科交叉前沿
138,吴菁芃：现代物流信息化技术系列专题（三）
139,吴菁芃：现代物流信息化技术系列专题（四）
140,赛迪洞察：AI在工业互联网平台的应用场景和路径分析
141,倪光南：中国自己的科技能不能支撑国内大循环
142,人工智能：时代抛弃你时，连一声再见都不会跟你说
143,苏宁王俊杰:5G引领技术变革
144,智能革命与国家治理现代化初探
145,国家新一代人工智能标准体系建设指南
146,恒大造车路：“六车齐发”的背后逻辑
147,2020新兴产业政策法规白皮书（附件）
148,吴菁芃：百鸟朝凤—数字供应链探究
149,智能包装技术应用与未来趋势
150,吴菁芃：物联网技术在物流业应用回顾与展望
151,长江产经智库：从特斯拉的盈利看新能源汽车成功的条件
152,世界人工智能发展究竟到了什么水平
153,风电发力机如何运行和维护？
154,2020下半年越来越火的9大IT技术！
155,持续数月的在线学习，为AI和网络素养教育带来哪些启示？
156,报告连载| 人工智能在物流行业中的应用前瞻报告（一）
157,报告连载| 人工智能是物流数据底盘的三大核心技术之一（二）
158,中国“新基建”发展研究报告：156页深度解读
159,NB-IoT正式纳入5G标准！
160,英国央行：CBDC的平台模型（下）
161,英国央行：CBDC的平台模型（上）概览
162,2019年我国“三新”经济增加值
163,【经济学人】技术季刊：AI及其局限 | 精华
164,全球化区块链投融资图谱：产业链成主风口
165,VR技术对传统会展业的影响
166,广东发力布局技术创新赋能路径
167,我们所理解的“工业软件”
168,实际应用中的AI：人工智能与企业IT的距离有多远？
169,高端核心技术缺失 汽车供应链再思考
170,郭源生：以感知技术为基础打造数字产业创新生态
171,如何实现实体空间与赛博空间的连接
172,孙正义：看未来30年：这个趋势，永远不会错
173,如何实现实体空间与赛博空间的连接
174,中国工程院院士徐匡迪发声：我国颠覆性技术是被专家“投”没的
175,解密品牌广告新趋势：如何变革？路径何在？
176,100页精华PPT，帮你彻底看懂5G！
177,商汤视觉AI新基建生态白皮书｜应用篇
178,5G专网如何更好适配工业互联网？
179,广州已过万重山
180,潜力深厚的数字孪生技术
181,科信技术能否走出5G黎明前的黑暗？
182,多样选择与灵活的两面性：零工经济研究中的争论与悖论
183,全球计算机科学和电子领域前 1000 名出现更多中国身影
184,在“5G VR”中感受无限风光 
185,5G技术成为中国新经济的主引擎
186,数据质量：数据治理的核心
187,CEO周军：AI识别技术将持续增长
188,美云智数工业仿真SaaS为中国企业“智”造强身！
189,阿里巴巴打造全息商品中心:微美全息AR电商系统沉浸式未来购物体验
190,大数据安全研究综述（下）
191,大数据安全研究综述（上）
192,互联网企业：如何建设数据安全体系？
193,李志刚：千亿巨头将在工业互联网领域诞生
194,追问人工智能：从剑桥到北京
195,智能售货机纳入“新基建”方案！
196,人工智能与数字经济广东省实验室首期建设投入20亿
197,从技术原理解析区块链为何列入新基建
198, “一业带百业”，新基建前景可期
199,尹烨：解密基因密码，再识生命科学
200,埃森哲技术：新数字时代的人与技术
201,马云养猪 马化腾养鹅 刘强东养鸡：从互联网角斗场，走向养殖场
202,2020 温州市智能化技术改造现场推进会
203,“人工智能+制造”，本质是追求人机协同！
204,智能制造专家蒋明炜：AI融入智能制造之道
205,"一台国产光刻机问世, “中国芯”得到新的助力！"
206,制造业对中国未来到底有多重要？
207,迈瑞医疗：自主研发国产呼吸机
208,AI能否成为新冠肺炎的“终结者”？
209,中国信息化发展八大趋势
210,疫情加速传统营销“死亡”以技术和数据驱动的智能营销将成常态
211,魏少军：芯片技术尚不可替代 摩尔定律将长期有效
212,虚拟工厂 ：实现中国制造2025的创新路径
213,走近无接触时代
214,中外13位科学家联合撰文：新冠肺炎或推动机器人技术研究
215,新基建政策落地+融合5G技术
216,阿里双11集团技术总指挥汤兴：一场不亚于移动化的变革已经发生
217,工业互联网创新发展的“新引擎”
218,“新基建”生态图谱，云计算大数据篇
219,环境变化与制造业企业的未来
220,IEEE 2020 ：12大技术趋势
221,易观千帆数字：2020春季全民战“疫”推动“宅经济”崛起
222,疫情下重新认识5G的发展
223,未来企业竞争：精细化和数据化
224,科技公司如何利用大数据防控疫情？
225,大数据的逻辑
226,美国国会听证会：用区块链技术改变世界
227,人工智能将推动新零售走向下一个风口
228,​OPPO天猫智慧门店的人工智能技术应用
229,人工智能技术应用对顾客购买意愿的影响研究
230,乔治·吉尔德：网络未来 密算体系的崛起
231,快速变革的技术将决定高科技产业的未来
232,国际首条车联网区块链IOV Blockchain于粤黄埔正式面向全球开源
233,悦刻旗舰店落户上海：科技、互动成两大关键词
234,百度高宇飞：用AI驱动理解打动用户
235,为什么说微软、谷歌、亚马逊等科技巨头殊途同归的终局是AIoT？
236,德国发布AI和数据伦理的75项建议并提出数据和算法协同治理等理念 
237,管窥京东数科区块链技术应用全景，助推产业互联网升级
238,美国智库预测中国一领域会领跑全球
239,达摩院2020十大科技趋势发布
240,新金融给予“民工欠薪”新的解决方案
241,区块链更广阔的舞台是制造业？
242,专家眼中新技术如何成为经济增长点？
243,清华教授劳东燕：人脸识别技术的隐忧
244,宋华：区块链 云计算 IoT等如何在供应链中有效应用？
245,阿里P8架构师谈：分布式锁的3种实现
246,科技赋能时尚：沉浸式体验，想象力燃爆
247,“数据中台”是一个伪概念吗？
248,中国人民大学副校长吴晓求：区块链的核心价值是数字经济的确权
249,纳米技术对未来智慧城市的影响
250,Gartner发布：2020年十大战略科技发展趋势
251,新华社：高科技助力物流行业应对“高峰”挑战
252,宋华：区块链不能解决产业供应链中所有存在的问题
253,《全球传播生态蓝皮书(2019)》：5G应用前景巨大
254,麦当劳与人工智能结合 消费者将会受到怎样的影响？
255,哈啰出行：建生态、拓边界和理性竞争
256,Login2020--华为云前沿技术与最佳实践年度盛会
257,全域智能营销构建商业价值新生态
258,王坚院士：科技解释未来商业的三个结论
259,任正非：我们处在爆炸式创新的前夜
260,嘉楠赴美上市：中国硬核科技公司
261,人类智慧与人工智能：医生的AI，还是AI医生？
262,十年阿里云，探路无人区
263,房殿军：技术推动物流呈螺旋式发展
264,AI 时代企业的全方位升级需要哪些准备？
265,2020年十大战略技术趋势
266,5G时代广告营销变革
267,图灵奖得主：人类正进入下一轮信息科学时代，社会将因此改变
268,数字时代全球挑战与建议
269,未来10年，B端产品走向平台化
270,深度研究：5G技术将如何改变物流业？
271,王振辉：5G时代京东物流已做好准备
272,区块链，贵觉不爱
273,互联网时代的过度算法是一种“机器官僚主义”
274,区块链与互联网的信息博弈
275,相峰：区块链与电商物流重塑
276,FinTech与BigTech：谁真正威胁银行业的未来
277,区块链和货币的本质是什么？
278,恒大新能源汽车：联手全球汽车工业巨头召开史诗级峰会
279,11个重点技术领域决定未来制造业
280,天猫双11包裹为啥这么快？
281,陈春花：腾讯“科技向善”并不是凭空出现的
282,区块链+工业4.0，人类的终极风口还是终极骗局？
283,Gartner : 2020年十大战略科技发展趋势
284,全球音乐流媒体老大Spotify上线直播功能
285,中美区块链产业的差异化路径
286,顺丰科技 | 用“智慧+精准算法”助推安防产业升级
287,dexFreight CEO：区块链智能合约助力物流业转型升级
288, 金融+区块链：走出喧嚣（下）
289, 金融+区块链：走出喧嚣（上）
290,AI频谱争夺战，对5G意味着什么？
291,国际调查：50年后数字经济如何发展？
292,阿里张建锋：CTO越懂技术越麻烦，更多要看未来需要什么技术
293,区块链话语权与制高点之争事关中国未来
294,阿里董事长：数字化时代的大趋势是正和博弈、增量发展
295,李彦宏：人工智能经济正在来临
296,锂电池：彻底改变了我们的生活
297,2019诺贝尔化学奖得主：吉野彰教授专访
298,人工智能产业发展迎来政策组合拳
299,边缘计算深度研究：5G时代的万亿大市场
300,电商与快递业的智能装备与技术
301,中国严重依赖进口的20项科技产品盘点
302,人工智能时代的法学新课题
303,AI和区块链技术下的跨境支付战况
304,院士专家谈5G发展和5G安全
305,现代物理学的忧伤
306,5G技术与智能制造构建未来工厂
307,瓦解与重生：旗袍企业如何用AI技术实现逆转
308,谁在真正领跑 5G：技术创新和标准
309,20家企业引领全球人工智能革命
310,未来可能发生的十大颠覆性创新
311,无人驾驶驶向5G时代
312,5G赋能AR／VR产业发展
313,MIT（麻省理工学院）研究：人工智能时代我们通过触觉“看”世界！
314,5G时代下物流业的巨大变革
315,5G时代引领淘宝直播崛起
316,5G技术商用化将为零售产业带来巨大变革
317,新一代物流技术的发展现状及发展趋势
318,物流科技最新资讯
319,Facebook：Libra（天秤币）解密
320,Facebook 数字货币：起源、作用和后果
321,云计算在AI和物联网领域的应用
322,移动机器人：市场、模式及应用
323,云计算：市场需求与竞争格局
324,人工智能（AI）在物流行业的应用
325,区块链技术的经济学解释
326,区块链技术Token的应用与逻辑
327,5G技术将颠覆全球20个行业
328,区块链技术在电商平台的应用
329,从国内到国际：华为的区块链服务
330,智慧物流发展路径：从数字化到智能化
331,科技赋能物流仓运配
332,区块链技术在零售行业的应用
333,服装电商的仓库选址和库内布局技巧
334,电商企业如何选择分拣解决方案
335,无人化与数字化是智慧物流的发展方向
336,人工智能vs机器智能：谁能抢占智慧物流
